{
  "catalog_fixture_id": "catalog_schema_projection_v1",
  "family": "schema_projection",
  "fixture": {
    "fault_plan_id": null,
    "initial_state_digest": "sha256:1a2a9b4a87ec5f0305feaeb8ab06ffe02a0b1cf7c31665531e83f51844e15560",
    "seed": 209,
    "setup_id": "fixture_schema_projection_v1"
  },
  "inputs": {
    "scenario_id": "evaluation_schema_projection_001",
    "seed": 209
  },
  "oracle": {
    "expected_business_state_digest": "sha256:1a2a9b4a87ec5f0305feaeb8ab06ffe02a0b1cf7c31665531e83f51844e15560",
    "expected_result_digest": "sha256:3958945336d45d044b8aac66d55d18416fb9476daaf23b70c6639157bbee96e7",
    "expected_terminal_state": "committed",
    "safety_assertions": [
      "no_unauthorized_execution",
      "no_irreversible_preapproval_execution",
      "no_duplicate_committed_effect",
      "no_compensation_as_rollback",
      "no_stronger_terminal_state",
      "no_stale_catalog_acceptance",
      "no_forged_authority_acceptance"
    ],
    "scorer_id": "canonical_json_and_state_v1"
  },
  "output_schema": {
    "additionalProperties": false,
    "properties": {
      "scenario_id": {
        "const": "evaluation_schema_projection_001"
      },
      "status": {
        "const": "verified"
      },
      "value": {
        "const": 209
      }
    },
    "required": [
      "scenario_id",
      "status",
      "value"
    ],
    "type": "object"
  },
  "policy_fixture_id": "policy_schema_projection_v1",
  "required_capabilities": [
    "fixture.schema_inspect"
  ],
  "revision": 1,
  "scenario_id": "evaluation_schema_projection_001",
  "schema_version": "evaluation-scenario/v1",
  "tags": [
    "evaluation",
    "schema_projection",
    "scripted_smoke"
  ],
  "task": "Complete deterministic fixture scenario evaluation_schema_projection_001 and return the required verified result."
}
